[
  {
    "name": "Xpark Aquarium (Qingpu)",
    "region": "Taoyuan",
    "city": "Taoyuan",
    "district": "Zhongli",
    "indoor_outdoor": "Indoor",
    "categories": [
      "Aquarium",
      "Science"
    ],
    "tags": [
      "learning",
      "nature",
      "food",
      "AC"
    ],
    "cost_range": "600+",
    "age_range": [
      3,
      12
    ],
    "natural": false,
    "desc": "Modern aquarium with immersive tanks, penguins, and shows—great A/C learning day.",
    "website": "https://xpark.com.tw/",
    "map_link": "https://maps.google.com/?q=No.+105,+Chunde+Rd,+Zhongli+District,+Taoyuan+City",
    "drive_min": 15,
    "address_en": "No. 105, Chunde Rd, Zhongli District, Taoyuan City, Taiwan 320",
    "id": "xpark-aquarium-qingpu",
    "address_query": "Xpark Aquarium (Qingpu), Zhongli, Taoyuan, Taoyuan, Taiwan"
  },
  {
    "name": "Hutoushan Park (虎頭山)",
    "region": "Taoyuan",
    "city": "Taoyuan",
    "district": "Taoyuan District",
    "indoor_outdoor": "Outdoor",
    "categories": [
      "Trail",
      "Viewpoint"
    ],
    "tags": [
      "active",
      "nature",
      "dog friendly",
      "shade"
    ],
    "cost_range": "0",
    "age_range": [
      3,
      14
    ],
    "natural": true,
    "desc": "Shady city mountain with easy paths and viewpoints.",
    "website": "",
    "map_link": "https://maps.google.com/?q=No.+42,+Gongyuan+Rd.,+Taoyuan+Dist.,+Taoyuan+City+330023",
    "drive_min": 25,
    "address_en": "No. 42, Gongyuan Rd., Taoyuan Dist., Taoyuan City 330023, Taiwan",
    "id": "hutoushan-park",
    "address_query": "Hutoushan Park (虎頭山), Taoyuan District, Taoyuan, Taoyuan, Taiwan"
  },
  {
    "name": "Dayou Terraced Ecological Park (大有梯田生態公園)",
    "region": "Taoyuan",
    "city": "Taoyuan",
    "district": "Taoyuan District",
    "indoor_outdoor": "Outdoor",
    "categories": [
      "Play",
      "Scenic"
    ],
    "tags": [
      "active",
      "nature",
      "dog friendly",
      "photo"
    ],
    "cost_range": "0",
    "age_range": [
      2,
      12
    ],
    "natural": true,
    "desc": "Terraced lawns with slides and kid areas; easy strolls and photos.",
    "website": "",
    "map_link": "https://maps.google.com/?q=大有梯田生態公園",
    "drive_min": 25,
    "address_en": "Taoyuan District, Taoyuan, Taoyuan",
    "id": "dayou-terraced-ecological-park",
    "address_query": "Dayou Terraced Ecological Park (大有梯田生態公園), Taoyuan District, Taoyuan, Taoyuan, Taiwan"
  },
  {
    "name": "Xinshi Park (新勢公園)",
    "region": "Taoyuan",
    "city": "Taoyuan",
    "district": "Zhongli",
    "indoor_outdoor": "Outdoor",
    "categories": [
      "Play"
    ],
    "tags": [
      "active",
      "dog friendly",
      "nature"
    ],
    "cost_range": "0",
    "age_range": [
      2,
      12
    ],
    "natural": true,
    "desc": "Large playground and open lawns; bring scooters or a ball.",
    "website": "",
    "map_link": "https://maps.google.com/?q=新勢公園+中壢",
    "drive_min": 10,
    "address_en": "Zhongli, Taoyuan, Taoyuan",
    "id": "xinshi-park",
    "address_query": "Xinshi Park (新勢公園), Zhongli, Taoyuan, Taoyuan, Taiwan"
  },
  {
    "name": "Laojie River Greenway (老街溪)",
    "region": "Taoyuan",
    "city": "Taoyuan",
    "district": "Zhongli",
    "indoor_outdoor": "Outdoor",
    "categories": [
      "Bike",
      "Trail"
    ],
    "tags": [
      "active",
      "nature",
      "stroller",
      "dog friendly"
    ],
    "cost_range": "0",
    "age_range": [
      3,
      14
    ],
    "natural": true,
    "desc": "Flat riverside path with pocket parks—ideal for bikes and strollers.",
    "website": "",
    "map_link": "https://maps.google.com/?q=老街溪+中壢",
    "drive_min": 10,
    "address_en": "Zhongli, Taoyuan, Taoyuan",
    "id": "laojie-river-greenway",
    "address_query": "Laojie River Greenway (老街溪), Zhongli, Taoyuan, Taoyuan, Taiwan"
  },
  {
    "name": "Longtan Lake (龍潭大池)",
    "region": "Taoyuan",
    "city": "Taoyuan",
    "district": "Longtan",
    "indoor_outdoor": "Outdoor",
    "categories": [
      "Lake",
      "Boat"
    ],
    "tags": [
      "nature",
      "food",
      "dog friendly",
      "waterplay"
    ],
    "cost_range": "0",
    "age_range": [
      3,
      14
    ],
    "natural": true,
    "desc": "Lakeside strolls, bridge, and rental swan boats (extra).",
    "website": "",
    "map_link": "https://maps.google.com/?q=龍潭大池",
    "drive_min": 25,
    "address_en": "Longtan, Taoyuan, Taoyuan",
    "id": "longtan-lake",
    "address_query": "Longtan Lake (龍潭大池), Longtan, Taoyuan, Taoyuan, Taiwan"
  },
  {
    "name": "Shihmen Reservoir (石門水庫)",
    "region": "Taoyuan",
    "city": "Taoyuan",
    "district": "Daxi/Longtan",
    "indoor_outdoor": "Outdoor",
    "categories": [
      "Reservoir",
      "Viewpoint"
    ],
    "tags": [
      "nature",
      "picnic",
      "dog friendly"
    ],
    "cost_range": "1–200",
    "age_range": [
      3,
      14
    ],
    "natural": true,
    "desc": "Scenic dam views, picnic lawns, and short walks; small entry/parking fee.",
    "website": "",
    "map_link": "https://maps.google.com/?q=石門水庫",
    "drive_min": 35,
    "address_en": "Daxi/Longtan, Taoyuan, Taoyuan",
    "id": "shihmen-reservoir",
    "address_query": "Shihmen Reservoir (石門水庫), Daxi/Longtan, Taoyuan, Taoyuan, Taiwan"
  },
  {
    "name": "Daxi Old Street & Bridge",
    "region": "Taoyuan",
    "city": "Taoyuan",
    "district": "Daxi",
    "indoor_outdoor": "Outdoor",
    "categories": [
      "Old Street",
      "Culture"
    ],
    "tags": [
      "food",
      "snacks",
      "stroller",
      "dog friendly"
    ],
    "cost_range": "0",
    "age_range": [
      4,
      14
    ],
    "natural": false,
    "desc": "Historic shopfronts, snacks, and riverside walk.",
    "website": "",
    "map_link": "https://maps.google.com/?q=Daxi+Old+Street",
    "drive_min": 35,
    "address_en": "Daxi, Taoyuan, Taoyuan",
    "id": "daxi-old-street-bridge",
    "address_query": "Daxi Old Street & Bridge, Daxi, Taoyuan, Taoyuan, Taiwan"
  },
  {
    "name": "Cihu Memorial Sculpture Park",
    "region": "Taoyuan",
    "city": "Taoyuan",
    "district": "Daxi",
    "indoor_outdoor": "Outdoor",
    "categories": [
      "Culture",
      "Scenic"
    ],
    "tags": [
      "learning",
      "nature",
      "dog friendly"
    ],
    "cost_range": "0",
    "age_range": [
      5,
      14
    ],
    "natural": true,
    "desc": "Open-air park with historic statues and lakeside paths.",
    "website": "",
    "map_link": "https://maps.google.com/?q=Cihu+Memorial+Park",
    "drive_min": 35,
    "address_en": "Daxi, Taoyuan, Taoyuan",
    "id": "cihu-memorial-sculpture-park",
    "address_query": "Cihu Memorial Sculpture Park, Daxi, Taoyuan, Taoyuan, Taiwan"
  },
  {
    "name": "Yong’an Fishing Harbor (永安漁港)",
    "region": "Taoyuan",
    "city": "Taoyuan",
    "district": "Xinwu",
    "indoor_outdoor": "Outdoor",
    "categories": [
      "Waterfront",
      "Promenade",
      "Bike"
    ],
    "tags": [
      "nature",
      "food",
      "dog friendly",
      "active"
    ],
    "cost_range": "0",
    "age_range": [
      3,
      14
    ],
    "natural": true,
    "desc": "Sea-view boardwalk and seafood market; easy family cycling.",
    "website": "",
    "map_link": "https://maps.google.com/?q=永安漁港",
    "drive_min": 45,
    "address_en": "Xinwu, Taoyuan, Taoyuan",
    "id": "yongan-fishing-harbor",
    "address_query": "Yong’an Fishing Harbor (永安漁港), Xinwu, Taoyuan, Taoyuan, Taiwan"
  },
  {
    "name": "Xiao Wulai Skywalk & Waterfall",
    "region": "Taoyuan",
    "city": "Taoyuan",
    "district": "Fuxing",
    "indoor_outdoor": "Outdoor",
    "categories": [
      "Viewpoint",
      "Waterfall"
    ],
    "tags": [
      "nature",
      "active",
      "view"
    ],
    "cost_range": "1–200",
    "age_range": [
      5,
      14
    ],
    "natural": true,
    "desc": "Glass skywalk over a waterfall; short nature trails.",
    "website": "",
    "map_link": "https://maps.google.com/?q=小烏來天空步道",
    "drive_min": 70,
    "address_en": "Fuxing, Taoyuan, Taoyuan",
    "id": "xiao-wulai-skywalk-waterfall",
    "address_query": "Xiao Wulai Skywalk & Waterfall, Fuxing, Taoyuan, Taoyuan, Taiwan"
  },
  {
    "name": "Window on China Theme Park (小人國)",
    "region": "Taoyuan",
    "city": "Taoyuan",
    "district": "Longtan",
    "indoor_outdoor": "Mixed",
    "categories": [
      "Theme Park",
      "Rides",
      "Waterplay"
    ],
    "tags": [
      "rides",
      "active",
      "food",
      "seasonal"
    ],
    "cost_range": "200–600",
    "age_range": [
      4,
      14
    ],
    "natural": false,
    "desc": "Rides and miniature landmarks; seasonal splash area.",
    "website": "https://www.woc.com.tw/",
    "map_link": "https://maps.google.com/?q=Window+on+China+Theme+Park",
    "drive_min": 30,
    "address_en": "Longtan, Taoyuan, Taoyuan",
    "id": "window-on-china-theme-park",
    "address_query": "Window on China Theme Park (小人國), Longtan, Taoyuan, Taoyuan, Taiwan"
  },
  {
    "name": "Leofoo Village Theme Park",
    "region": "Hsinchu",
    "city": "Hsinchu",
    "district": "Guanxi",
    "indoor_outdoor": "Mixed",
    "categories": [
      "Theme Park",
      "Zoo",
      "Rides"
    ],
    "tags": [
      "rides",
      "active",
      "food",
      "learning"
    ],
    "cost_range": "600+",
    "age_range": [
      5,
      14
    ],
    "natural": false,
    "desc": "Big theme park with safari-style zoo zones.",
    "website": "https://www.leofoovillage.com.tw/",
    "map_link": "https://maps.google.com/?q=Leofoo+Village",
    "drive_min": 40,
    "address_en": "Guanxi, Hsinchu, Hsinchu",
    "id": "leofoo-village-theme-park",
    "address_query": "Leofoo Village Theme Park, Guanxi, Hsinchu, Hsinchu, Taiwan"
  },
  {
    "name": "Green World Ecological Farm (綠世界)",
    "region": "Hsinchu",
    "city": "Hsinchu",
    "district": "Beipu",
    "indoor_outdoor": "Mixed",
    "categories": [
      "Eco Park",